{
  "roleId": "flutter-engineer",
  "name": "Flutter 工程师",
  "department": "software",
  "description": "负责 Flutter 客户端功能开发、跨端调试与发布协作。",
  "requiredSkills": [
    "git-workflow",
    "roleclaw",
    "cloud-pet-flutter-module"
  ],
  "optionalSkills": [],
  "requiredRules": [
    "engineering-rules-baseline"
  ],
  "optionalRules": [],
  "extends": [],
  "status": "active"
}
