{
  "roleId": "test-engineer",
  "name": "测试工程师",
  "department": "software",
  "description": "负责测试设计、质量验证、缺陷跟踪与回归确认。",
  "requiredSkills": [
    "git-workflow",
    "roleclaw"
  ],
  "optionalSkills": [],
  "requiredRules": [
    "engineering-rules-baseline"
  ],
  "optionalRules": [],
  "extends": [],
  "status": "active"
}
